{"$schema":"https://json-schema.org/draft/2020-12/schema","$id":"experiment-plan.schema.json","title":"Experiment Plan","type":"object","required":["schema_version","hypothesis","independent_variables","dependent_variables","baselines","fixed_budgets","scenes","metrics","seeds","repetitions","tolerances","ablations","resource_estimate","stop_conditions"],"properties":{"schema_version":{"type":"string","minLength":1,"pattern":"\\S"},"hypothesis":{"type":"string","minLength":1,"pattern":"\\S"},"independent_variables":{"type":"array","minItems":1,"items":{"type":"string","minLength":1,"pattern":"\\S"}},"dependent_variables":{"type":"array","minItems":1,"items":{"type":"string","minLength":1,"pattern":"\\S"}},"baselines":{"type":"array","minItems":1,"items":{"type":"string","minLength":1,"pattern":"\\S"}},"fixed_budgets":{"type":"object","minProperties":1},"scenes":{"type":"array","minItems":1,"items":{"type":"string","minLength":1,"pattern":"\\S"}},"metrics":{"type":"array","minItems":1,"items":{"type":"string","minLength":1,"pattern":"\\S"}},"seeds":{"type":"array","minItems":1,"items":{"type":"integer"}},"repetitions":{"type":"integer","minimum":1},"tolerances":{"type":"object","minProperties":1},"ablations":{"type":"array","minItems":1,"items":{"type":"string","minLength":1,"pattern":"\\S"}},"resource_estimate":{"type":"object","minProperties":1},"stop_conditions":{"type":"array","minItems":1,"items":{"type":"string","minLength":1,"pattern":"\\S"}}},"additionalProperties":false}
