{"schema_version":"1","hypothesis":"Smaller steps reduce penetration.","independent_variables":["fixed_dt"],"dependent_variables":["max_penetration"],"baselines":["60 Hz"],"fixed_budgets":{"cpu_ms":4},"scenes":["stack"],"metrics":["penetration"],"seeds":[1,2,3],"repetitions":3,"tolerances":{"penetration":0.01},"ablations":["no CCD"],"resource_estimate":{"hours":4},"stop_conditions":["budget exhausted"]}
